{
  "$schema": "../schemas/endpoint.schema.json",
  "name": "SGLang",
  "provider_class": "openai-compatible",
  "base_url": "http://localhost:30000/v1",
  "default_port": 30000,
  "requires_key": false,
  "model_list_style": "openai",
  "tool_support_notes": "Start SGLang with a tool-call parser matching the served model.",
  "launch_flags": "--tool-call-parser <parser>"
}
